{
  "$schema": "https://json-schema.org/draft/2020-12/schema",
  "type": "object",
  "properties": {
    "schemaVersion": {
      "type": "string",
      "const": "legion-cli-delivery-predicate/v1"
    },
    "confirmation": {
      "type": "string",
      "format": "uuid",
      "pattern": "^([0-9a-fA-F]{8}-[0-9a-fA-F]{4}-[1-8][0-9a-fA-F]{3}-[89abAB][0-9a-fA-F]{3}-[0-9a-fA-F]{12}|00000000-0000-0000-0000-000000000000|ffffffff-ffff-ffff-ffff-ffffffffffff)$"
    },
    "approval": {
      "anyOf": [
        {
          "type": "string",
          "format": "uuid",
          "pattern": "^([0-9a-fA-F]{8}-[0-9a-fA-F]{4}-[1-8][0-9a-fA-F]{3}-[89abAB][0-9a-fA-F]{3}-[0-9a-fA-F]{12}|00000000-0000-0000-0000-000000000000|ffffffff-ffff-ffff-ffff-ffffffffffff)$"
        },
        {
          "type": "null"
        }
      ]
    },
    "spec": {
      "anyOf": [
        {
          "type": "string",
          "format": "uuid",
          "pattern": "^([0-9a-fA-F]{8}-[0-9a-fA-F]{4}-[1-8][0-9a-fA-F]{3}-[89abAB][0-9a-fA-F]{3}-[0-9a-fA-F]{12}|00000000-0000-0000-0000-000000000000|ffffffff-ffff-ffff-ffff-ffffffffffff)$"
        },
        {
          "type": "null"
        }
      ]
    },
    "assuranceManifestDigest": {
      "anyOf": [
        {
          "type": "string",
          "pattern": "^[a-f0-9]{64}$"
        },
        {
          "type": "null"
        }
      ]
    },
    "subjectDigest": {
      "type": "string",
      "pattern": "^[a-f0-9]{64}$"
    },
    "executionDigest": {
      "type": "string",
      "pattern": "^[a-f0-9]{64}$"
    },
    "mode": {
      "type": "string",
      "enum": [
        "not-adopted",
        "information-flow",
        "adapter-default"
      ]
    },
    "traceStatus": {
      "type": "string",
      "enum": [
        "valid",
        "not-adopted"
      ]
    },
    "modelDigest": {
      "anyOf": [
        {
          "type": "string",
          "pattern": "^[a-f0-9]{64}$"
        },
        {
          "type": "null"
        }
      ]
    },
    "policyDigest": {
      "anyOf": [
        {
          "type": "string",
          "pattern": "^[a-f0-9]{64}$"
        },
        {
          "type": "null"
        }
      ]
    },
    "identities": {
      "maxItems": 1024,
      "type": "array",
      "items": {
        "type": "object",
        "properties": {
          "token": {
            "type": "string",
            "format": "uuid",
            "pattern": "^([0-9a-fA-F]{8}-[0-9a-fA-F]{4}-[1-8][0-9a-fA-F]{3}-[89abAB][0-9a-fA-F]{3}-[0-9a-fA-F]{12}|00000000-0000-0000-0000-000000000000|ffffffff-ffff-ffff-ffff-ffffffffffff)$"
          },
          "kind": {
            "type": "string",
            "enum": [
              "task",
              "acceptance",
              "check",
              "profile",
              "model",
              "host"
            ]
          },
          "digest": {
            "anyOf": [
              {
                "type": "string",
                "pattern": "^[a-f0-9]{64}$"
              },
              {
                "type": "null"
              }
            ]
          }
        },
        "required": [
          "token",
          "kind",
          "digest"
        ],
        "additionalProperties": false
      }
    },
    "checks": {
      "maxItems": 512,
      "type": "array",
      "items": {
        "type": "object",
        "properties": {
          "token": {
            "type": "string",
            "format": "uuid",
            "pattern": "^([0-9a-fA-F]{8}-[0-9a-fA-F]{4}-[1-8][0-9a-fA-F]{3}-[89abAB][0-9a-fA-F]{3}-[0-9a-fA-F]{12}|00000000-0000-0000-0000-000000000000|ffffffff-ffff-ffff-ffff-ffffffffffff)$"
          },
          "status": {
            "type": "string",
            "enum": [
              "passed",
              "failed",
              "unavailable"
            ]
          },
          "inputDigest": {
            "anyOf": [
              {
                "type": "string",
                "pattern": "^[a-f0-9]{64}$"
              },
              {
                "type": "null"
              }
            ]
          },
          "resultDigest": {
            "anyOf": [
              {
                "type": "string",
                "pattern": "^[a-f0-9]{64}$"
              },
              {
                "type": "null"
              }
            ]
          }
        },
        "required": [
          "token",
          "status",
          "inputDigest",
          "resultDigest"
        ],
        "additionalProperties": false
      }
    },
    "acceptance": {
      "maxItems": 256,
      "type": "array",
      "items": {
        "type": "object",
        "properties": {
          "token": {
            "type": "string",
            "format": "uuid",
            "pattern": "^([0-9a-fA-F]{8}-[0-9a-fA-F]{4}-[1-8][0-9a-fA-F]{3}-[89abAB][0-9a-fA-F]{3}-[0-9a-fA-F]{12}|00000000-0000-0000-0000-000000000000|ffffffff-ffff-ffff-ffff-ffffffffffff)$"
          },
          "status": {
            "type": "string",
            "enum": [
              "passed",
              "failed",
              "unknown"
            ]
          },
          "evidenceDigest": {
            "anyOf": [
              {
                "type": "string",
                "pattern": "^[a-f0-9]{64}$"
              },
              {
                "type": "null"
              }
            ]
          }
        },
        "required": [
          "token",
          "status",
          "evidenceDigest"
        ],
        "additionalProperties": false
      }
    },
    "preparedAt": {
      "type": "string",
      "pattern": "^\\d{4}-\\d{2}-\\d{2}T\\d{2}:\\d{2}:\\d{2}\\.\\d{3}Z$"
    }
  },
  "required": [
    "schemaVersion",
    "confirmation",
    "approval",
    "spec",
    "assuranceManifestDigest",
    "subjectDigest",
    "executionDigest",
    "mode",
    "traceStatus",
    "modelDigest",
    "policyDigest",
    "identities",
    "checks",
    "acceptance",
    "preparedAt"
  ],
  "additionalProperties": false
}
