{"acceptance":[{"evidenceDigest":"76e02bf96bdb79bb61bb3bdeb612038c04fdf76f85dcc54aa022baf8486c741a","status":"passed","token":"d49e4073-4266-4d07-884e-a041bf365252"}],"approval":"3589b969-d6f4-4a6a-959d-d68a9360fc29","assuranceManifestDigest":"dbbc932127cc6c594feec69d5e7cc4b181e2632084643d547461ff530546051d","checks":[{"inputDigest":"2937bd7965e9a653df0ab9466f18881945dd86f6e4edb1ea3c84fdcd954d7ec1","resultDigest":"59c785c313be73fc6295557a90174e3962d40097eba25cf8968481a90a560a11","status":"passed","token":"b4f2f944-d8a2-47af-96ca-5b8dd1dc778a"}],"confirmation":"ded9e656-59fb-4ee7-88ca-84014691a5e0","executionDigest":"d1e94dcf2fd55444960dafcfdc9d0e505b0fed6cf8910d0ae8f80f7e33a4645f","identities":[{"digest":null,"kind":"task","token":"b2afc7e8-8abb-4f94-aef8-46e668bf3251"},{"digest":null,"kind":"acceptance","token":"d49e4073-4266-4d07-884e-a041bf365252"},{"digest":"32b51a1486ea078d8ec3941a52b0d6f7f2b8e6b095c702af60ce1c809ba58e87","kind":"check","token":"b4f2f944-d8a2-47af-96ca-5b8dd1dc778a"},{"digest":null,"kind":"model","token":"d055e5e5-7509-4b6b-b9e5-922e7fd5a4b2"},{"digest":"55657bbee9475c45f1a323159edb5882baa6bb1b9baafc212f947879cad10f13","kind":"host","token":"3bbbcc7a-dbc9-4640-bb38-4f98886b2bb4"}],"mode":"information-flow","modelDigest":"4a06d131db4a14e0b818901ab34ba497c3bddd1f39d7c79d48b7a26c8581738d","policyDigest":"dbbc932127cc6c594feec69d5e7cc4b181e2632084643d547461ff530546051d","preparedAt":"2026-10-05T02:00:09.599Z","schemaVersion":"legion-cli-delivery-predicate/v1","spec":"9d700517-b027-4a91-b77c-13f0164ff208","subjectDigest":"2da382ed589fec182a39ffd1b7269d7b96e433f8936a92dd45942f746f608ef5","traceStatus":"valid"}